{
  "status": "ok",
  "verdict": "block",
  "blocker": "验收项2：cleaned_orders.json 字段缺失 valid 标志",
  "root": "self",
  "confidence": 0.6,
  "reason": "验收不通过：cleaned_orders.json 缺失 valid 字段，且 executor 未在交付说明中自测该项",
  "tokens": 0,
  "detail": {
    "done_entries": 2,
    "declared": ["src/data/cleaned_orders.json"],
    "missing": [],
    "acceptance_failed": ["验收项2：每条记录含 valid 标志"],
    "root_class": "self"
  }
}
